{
    "$schema": "../schemas/recipe.schema.json",
    "title": "Soft Sugar Cookie Cutouts",
    "subtitle": "These crisp edged, soft thick centered cookies makes this recipe a must try! Great for any occasion and works well with cutouts.",
    "subtitle2": "These are my favorite sugar cookies with icing! They are almondy, buttery, sweet, and have beautifully soft centers. I normally am not a huge fan of sugar cookies but these have converted me! They are extremely fun to decorate and keep well! Works great for gifts or just for a delcious dessert.",
    "categories": {
        "Cookies": {
            "ingredients": {
                "cookies-flour": {
                    "quantity": 2.25,
                    "unitTag": "cup",
                    "ingredient": "all-purpose flour (spoon & leveled), plus more as needed for rolling and work surface"
                },
                "cookies-baking-powder": {
                    "quantity": 0.5,
                    "unitTag": "tsp",
                    "ingredient": "baking powder"
                },
                "cookies-salt": {
                    "quantity": 0.25,
                    "unitTag": "tsp",
                    "ingredient": "salt"
                },
                "cookies-butter": {
                    "quantity": 0.75,
                    "unitTag": "cup",
                    "ingredient": "unsalted butter, softened to room temperature"
                },
                "cookies-sugar": {
                    "quantity": 0.75,
                    "unitTag": "cup",
                    "ingredient": "granulated sugar"
                },
                "cookies-egg": {
                    "quantity": 1,
                    "unitTag": "large egg"
                },
                "cookies-vanilla": {
                    "quantity": 2,
                    "unitTag": "tsp",
                    "ingredient": "pure vanilla extract"
                },
                "cookies-almond": {
                    "quantity": 0.25,
                    "unitTag": "tsp",
                    "ingredient": "(or double) almond extract (optional, but makes the flavor outstanding)"
                }
            }
        },
        "Icing": {
            "ingredients": {
                "icing-sugar": {
                    "quantity": 3,
                    "unitTag": "cup",
                    "ingredient": "confectioners' sugar"
                },
                "icing-vanilla": {
                    "quantity": 0.5,
                    "unitTag": "tsp",
                    "ingredient": "pure vanilla extract"
                },
                "icing-corn-syrup": {
                    "quantity": 2,
                    "unitTag": "tsp",
                    "ingredient": "light corn syrup"
                },
                "icing-water": {
                    "quantity": 4.5,
                    "unitTag": "tbsp",
                    "ingredient": "(or more) room temperature water"
                },
                "icing-salt": {
                    "ingredient": "pinch of salt"
                }
            }
        }
    },
    "steps": [
        "^Whisk$ the flour, baking powder, and salt together in a ^medium bowl$. Set aside.",
        "In a ^large bowl$ using a ^hand mixer$ or a ^stand mixer$ fitted with a paddle attachment, <b>beat the butter and sugar together on high speed until completely smooth and creamy, about 2 minutes</b>.",
        "Add the egg, vanilla, and almond extract (if using) and beat on high speed until combined, about 1 minute. Scrape down the sides and up the bottom of the bowl and beat again as needed to combine.",
        "Add the dry ingredients to the wet ingredients and mix on low until combined. <b>Dough will be relatively soft</b>. <i>If the dough seems too soft and sticky for rolling, add 1 more Tablespoon of flour</i>.",
        "Divide the dough into 2 equal parts. Place each portion onto a piece of lightly floured parchment paper or a lightly floured ^silicone baking mat$. With a lightly floured ^rolling pin$, roll the dough out to about <b>1/4-inch thickness</b>. Use more flour if the dough seems too sticky. The rolled-out dough can be any shape, as long as it is evenly 1/4-inch thick.",
        "Lightly dust one of the rolled-out doughs with flour. Place a piece of parchment on top. (This prevents sticking.) Place the 2nd rolled-out dough on top. Cover with plastic wrap or aluminum foil, then <b>refrigerate for at least 1-2 hours and up to 2 days</b>.",
        "Once chilled, <b>preheat oven to 350Â°F</b>. Line ^2-3 large baking sheets$ with parchment paper or silicone baking mats. Carefully remove the top dough piece from the refrigerator. If it's sticking to the bottom, run your hand under it to help remove it. Using a ^cookie cutter$, cut the dough into shapes. Re-roll the remaining dough and continue cutting until all is used. Repeat with 2nd piece of dough. (Note: It doesn't seem like a lot of dough, but you get a lot of cookies from the dough scraps you re-roll.)",
        "Arrange cookies on baking sheets <b>3 inches apart</b>. <b>Bake for 11-12 minutes or until lightly browned around the edges</b>. If your oven has hot spots, <b>rotate the baking sheet halfway through bake time</b>. Allow cookies to cool on the baking sheet for 5 minutes then transfer to a ^wire rack$ to cool completely before decorating.",
        "For the frosting, Using a fork, stir the confectioners sugar, vanilla, corn syrup, and !icing-water together in a medium bowl. It will be very thick and almost impossible to stir. Switch to a whisk and whisk in 1/2 Tablespoon (8ml) of water. If you lift the whisk and let the icing drizzle back into the bowl, the ribbon of icing will hold shape for a few seconds before melting back into the icing. That is when you know it's the right consistency and is ready to use. If it's too thick (sometimes it is), whisk in another 1/2 Tablespoon (8ml) of water or a little more until you reach the consistency.",
        "If desired, stir in gel food coloring. You can pour some icing into different bowls if using multiple colors. When tinting icing, only use 1-2 drops at first, stir it in, then add more as needed to reach your desired color. Remember, color darkens as icing dries.",
        "Decorate the cooled cookies with royal icing.",
        "Enjoy cookies right away or wait until the icing sets to serve them. Once the icing has set, these cookies are great for gifting or for sending. Plain or decorated cookies stay soft for about 5 days when covered tightly at room temperature. For longer storage, cover and refrigerate for up to 10 days."
    ],
    "preptime": "2 hrs",
    "cooktime": "12 minutes",
    "totaltime": "4 hrs",
    "serves": 24
}