{
    "$schema": "../schemas/recipe.schema.json",
    "title": "Turkish Eggs",
    "subtitle": "Perfect light meal for anytime of day! The soft cooked eggs compliment greek yogurt topped in a spicy chili brown butter sauce.",
    "subtitle2": "This is a week night classic in my house! Turkish eggs is a simple recipe that comes together in a short amount of time. This recipe also scales up well, so it easy to make for the entire family!",
    "ingredients": {
        "egg": {
            "quantity": 4,
            "unitTag": "egg"
        },
        "yogurt": {
            "quantity": 1,
            "unitTag": "cup",
            "ingredient": "greek yogurt"
        },
        "garlic": {
            "quantity": 1,
            "unitTag": "clove",
            "ingredient": "of garlic"
        },
        "dill": {
            "quantity": 1,
            "unitTag": "tsp",
            "ingredient": "dill"
        },
        "lemon-juice": {
            "quantity": 1,
            "unitTag": "tsp",
            "ingredient": "lemon juice"
        },
        "sea-salt": {
            "ingredient": "flaky sea salt"
        },
        "butter": {
            "quantity": 2,
            "unitTag": "tbsp",
            "ingredient": "butter"
        },
        "chili-powder": {
            "quantity": 0,
            "unitTag": "tsp",
            "ingredient": "(or double) chili powder"
        }
    },
    "steps": [
        "Fill a medium sized pot, halfway with water. Bring the water to a  boil.",
        "In a bowl mix the greek yogurt, lemon juice, a pinch of salt, and minced garlic.",
        "In a small pan, heat the butter until it is browned. Take off from heat. Add the chili powder and mix. Set aside.",
        "Add the eggs to the boiling water. Cook for 5 minutes. Immediately take out of boiling water and put in ice cold water. Peel the eggs and set aside.",
        "Between the plates, split the yogurt mixture. Make a swirl and for the eggs to sit in. Place the eggs evenly among the plates on top of the yogurt. Drizzle the butter chili oil on top of the eggs. Top with dill and flakey sea salt.",
        "Eat immediately with toast points or just on it's own."
    ],
    "preptime": "10 minutes",
    "cooktime": "5 minutes",
    "totaltime": "15 minutes",
    "serves": 2
}